{
  "manifestSchema": "urn:uuid:df95689a-85f7-4f17-b306-a05af10d8cb0",
  "protocolRelease": "ghostbridge/e1.r0-draft.1",
  "bundleId": "urn:uuid:dd80a69d-321a-4517-b484-c75afe114b21",
  "schemaDialect": "https://json-schema.org/draft/2020-12/schema",
  "status": "draft-prerelease",
  "completeness": "foundation-partial",
  "pathBase": "repository-relative",
  "schemas": [
    {
      "logicalName": "FoundationManifest",
      "schemaId": "urn:uuid:df95689a-85f7-4f17-b306-a05af10d8cb0",
      "assetClass": "d2-machinery",
      "path": "protocol/schemas/e1.r0-draft.1/machinery/foundation-manifest.schema.json",
      "dependencies": [],
      "provenance": {
        "h": ["H-03", "H-13", "H-14"],
        "req": ["REQ-DISC-0003", "REQ-VERS-0004", "REQ-COMP-0007", "REQ-COMP-0009"],
        "d2r": ["D2R-030"]
      }
    },
    {
      "logicalName": "SemanticConstraintInventory",
      "schemaId": "urn:uuid:7d66052a-8a55-4641-bd8d-8990c5db9940",
      "assetClass": "d2-machinery",
      "path": "protocol/schemas/e1.r0-draft.1/machinery/semantic-constraint-inventory.schema.json",
      "dependencies": [],
      "provenance": {
        "h": [
          "H-01",
          "H-02",
          "H-03",
          "H-04",
          "H-05",
          "H-06",
          "H-07",
          "H-08",
          "H-09",
          "H-10",
          "H-11",
          "H-12",
          "H-13",
          "H-14"
        ],
        "req": [
          "REQ-VERS-0016",
          "REQ-AUTH-0004",
          "REQ-CONN-0003",
          "REQ-INV-0007",
          "REQ-APPR-0014",
          "REQ-APPR-0018",
          "REQ-RCPT-0003",
          "REQ-TRUST-0012",
          "REQ-ERR-0004"
        ],
        "d2r": ["D2R-032"]
      }
    },
    {
      "logicalName": "ReleaseRegistry",
      "schemaId": "urn:uuid:927bbd7a-e229-440d-95f1-6ff0ebefe716",
      "assetClass": "d2-machinery",
      "path": "protocol/schemas/e1.r0-draft.1/machinery/release-registry.schema.json",
      "dependencies": ["urn:uuid:16534fa9-8aa1-4324-b6b9-a2a1043682f3"],
      "provenance": {
        "h": ["H-03", "H-04", "H-05", "H-07", "H-11", "H-13", "H-14"],
        "req": [
          "REQ-VERS-0009",
          "REQ-VERS-0011",
          "REQ-VERS-0012",
          "REQ-VERS-0016",
          "REQ-AUTH-0002",
          "REQ-AUTH-0003",
          "REQ-AUTH-0007",
          "REQ-AUTH-0008",
          "REQ-AUTH-0009"
        ],
        "d2r": ["D2R-004B", "D2R-007", "D2R-026", "D2R-027", "D2R-030"]
      }
    },
    {
      "logicalName": "ReleaseDataSource",
      "schemaId": "urn:uuid:377b6b6b-2c73-4309-9df8-343057a56e41",
      "assetClass": "d2-machinery",
      "path": "protocol/schemas/e1.r0-draft.1/release-data/release-data-source.schema.json",
      "dependencies": [
        "urn:uuid:85293782-58f5-4c69-aa5b-830dd8aa480d",
        "urn:uuid:e47a0317-4178-4ad3-8238-4c9aadce1cb2",
        "urn:uuid:876284f1-c7c1-468f-bab6-c679e564c3fe",
        "urn:uuid:cfe70791-b8f7-48f7-809f-f7c6872c3c46",
        "urn:uuid:f901bb9f-46b5-4b04-a2cd-4185e43f560e",
        "urn:uuid:001a31f0-2190-43f8-988d-8d3055450d28",
        "urn:uuid:9feb2499-b6f5-4b4b-875a-d6b65b861e3c"
      ],
      "provenance": {
        "h": ["H-03", "H-04", "H-13", "H-14"],
        "req": ["REQ-VERS-0009", "REQ-VERS-0011", "REQ-VERS-0012", "REQ-VERS-0016"],
        "d2r": ["D2R-004B", "D2R-007", "D2R-026", "D2R-027", "D2R-030", "D2R-032"]
      }
    },
    {
      "logicalName": "SourceClaimAuthorityRegistry",
      "schemaId": "urn:uuid:85293782-58f5-4c69-aa5b-830dd8aa480d",
      "assetClass": "release-data-registry",
      "path": "protocol/schemas/e1.r0-draft.1/release-data/source-claim-authority.schema.json",
      "dependencies": [],
      "provenance": {
        "h": ["H-03", "H-04", "H-13", "H-14"],
        "req": [
          "REQ-VERS-0011",
          "REQ-VERS-0012",
          "REQ-VERS-0013",
          "REQ-VERS-0014",
          "REQ-VERS-0016"
        ],
        "d2r": ["D2R-007"]
      }
    },
    {
      "logicalName": "ReleaseDataFixtureCorpus",
      "schemaId": "urn:uuid:d11fe4f0-85ee-4d0c-9210-778cb3cc4ef9",
      "assetClass": "d2-machinery",
      "path": "protocol/schemas/e1.r0-draft.1/release-data/release-data-fixture-corpus.schema.json",
      "dependencies": [],
      "provenance": {
        "h": ["H-03", "H-04", "H-13", "H-14"],
        "req": [
          "REQ-VERS-0011",
          "REQ-VERS-0012",
          "REQ-VERS-0013",
          "REQ-VERS-0016",
          "REQ-COMP-0007"
        ],
        "d2r": ["D2R-001", "D2R-004B", "D2R-007", "D2R-032"]
      }
    },
    {
      "logicalName": "DirectionalBindingRegistry",
      "schemaId": "urn:uuid:e47a0317-4178-4ad3-8238-4c9aadce1cb2",
      "assetClass": "release-data-registry",
      "path": "protocol/schemas/e1.r0-draft.1/release-data/directional-binding.schema.json",
      "dependencies": [],
      "provenance": {
        "h": ["H-03", "H-04", "H-06", "H-13", "H-14"],
        "req": ["REQ-INST-0002", "REQ-CONN-0003", "REQ-VERS-0016"],
        "d2r": ["D2R-007"]
      }
    },
    {
      "logicalName": "FacetPropertyRegistry",
      "schemaId": "urn:uuid:876284f1-c7c1-468f-bab6-c679e564c3fe",
      "assetClass": "release-data-registry",
      "path": "protocol/schemas/e1.r0-draft.1/release-data/facet-property.schema.json",
      "dependencies": [],
      "provenance": {
        "h": ["H-03", "H-04", "H-07", "H-08", "H-09", "H-10", "H-11", "H-12", "H-13"],
        "req": [
          "REQ-VERS-0011",
          "REQ-VERS-0012",
          "REQ-VERS-0013",
          "REQ-VERS-0014",
          "REQ-VERS-0016",
          "REQ-APPR-0022",
          "REQ-RCPT-0001"
        ],
        "d2r": ["D2R-007"]
      }
    },
    {
      "logicalName": "CoreCapabilityAllocationRegistry",
      "schemaId": "urn:uuid:cfe70791-b8f7-48f7-809f-f7c6872c3c46",
      "assetClass": "release-data-registry",
      "path": "protocol/schemas/e1.r0-draft.1/release-data/core-capability-allocation.schema.json",
      "dependencies": [],
      "provenance": {
        "h": ["H-04", "H-13"],
        "req": ["REQ-VERS-0011", "REQ-VERS-0013"],
        "d2r": ["D2R-007"]
      }
    },
    {
      "logicalName": "ExternalCapabilityEligibilityRegistry",
      "schemaId": "urn:uuid:f901bb9f-46b5-4b04-a2cd-4185e43f560e",
      "assetClass": "release-data-registry",
      "path": "protocol/schemas/e1.r0-draft.1/release-data/external-capability-eligibility.schema.json",
      "dependencies": [],
      "provenance": {
        "h": ["H-03", "H-04", "H-13", "H-14"],
        "req": ["REQ-VERS-0011", "REQ-VERS-0012", "REQ-VERS-0013", "REQ-VERS-0016"],
        "d2r": ["D2R-004B", "D2R-007"]
      }
    },
    {
      "logicalName": "GlobalFeatureAllocationRegistry",
      "schemaId": "urn:uuid:001a31f0-2190-43f8-988d-8d3055450d28",
      "assetClass": "release-data-registry",
      "path": "protocol/schemas/e1.r0-draft.1/release-data/global-feature-allocation.schema.json",
      "dependencies": [],
      "provenance": {
        "h": ["H-04", "H-13"],
        "req": ["REQ-VERS-0011", "REQ-VERS-0013"],
        "d2r": ["D2R-007"]
      }
    },
    {
      "logicalName": "AuthenticationProfileRegistry",
      "schemaId": "urn:uuid:9feb2499-b6f5-4b4b-875a-d6b65b861e3c",
      "assetClass": "release-data-registry",
      "path": "protocol/schemas/e1.r0-draft.1/release-data/authentication-profile.schema.json",
      "dependencies": [],
      "provenance": {
        "h": ["H-04", "H-05", "H-07", "H-11", "H-13"],
        "req": [
          "REQ-AUTH-0002",
          "REQ-AUTH-0003",
          "REQ-AUTH-0007",
          "REQ-AUTH-0008",
          "REQ-AUTH-0009",
          "REQ-VERS-0012"
        ],
        "d2r": ["D2R-026", "D2R-027"]
      }
    },
    {
      "logicalName": "FoundationFixtureCorpus",
      "schemaId": "urn:uuid:da99d351-12ed-42b8-8ddd-9fc761e638f0",
      "assetClass": "d2-machinery",
      "path": "protocol/schemas/e1.r0-draft.1/machinery/foundation-fixture-corpus.schema.json",
      "dependencies": [],
      "provenance": {
        "h": ["H-13", "H-14"],
        "req": ["REQ-COMP-0007", "REQ-EXT-0001", "REQ-EXT-0002"],
        "d2r": ["D2R-001", "D2R-032"]
      }
    },
    {
      "logicalName": "R1WireFixtureCorpus",
      "schemaId": "urn:uuid:96c77461-15e3-455b-b96c-626f2b060d58",
      "assetClass": "d2-machinery",
      "path": "protocol/schemas/e1.r0-draft.1/machinery/r1-wire-fixture-corpus.schema.json",
      "dependencies": [],
      "provenance": {
        "h": ["H-09", "H-10", "H-11", "H-12", "H-13", "H-14"],
        "req": [
          "REQ-APPR-0018",
          "REQ-RCPT-0003",
          "REQ-TRAN-0002",
          "REQ-TRAN-0003",
          "REQ-EXT-0004",
          "REQ-COMP-0007"
        ],
        "d2r": ["D2R-001", "D2R-004A", "D2R-017", "D2R-018", "D2R-020", "D2R-032"]
      }
    },
    {
      "logicalName": "R1RawFixtureCorpus",
      "schemaId": "urn:uuid:19b7f64a-9159-4a07-ac71-7404a64546e3",
      "assetClass": "d2-machinery",
      "path": "protocol/schemas/e1.r0-draft.1/machinery/r1-raw-fixture-corpus.schema.json",
      "dependencies": [],
      "provenance": {
        "h": ["H-10", "H-12", "H-13", "H-14"],
        "req": ["REQ-APPR-0018", "REQ-TRAN-0013", "REQ-EXT-0001", "REQ-COMP-0007"],
        "d2r": ["D2R-001", "D2R-014", "D2R-029", "D2R-029A", "D2R-032"]
      }
    },
    {
      "logicalName": "CanonicalBase64url32Octets",
      "schemaId": "urn:uuid:d62d6621-999a-43f1-bf80-08c253750ac9",
      "assetClass": "representation-helper",
      "path": "protocol/schemas/e1.r0-draft.1/primitives/canonical-base64url-32-octets.schema.json",
      "dependencies": [],
      "provenance": {
        "h": ["H-10"],
        "req": [
          "REQ-APPR-0018",
          "REQ-RCPT-0003",
          "REQ-RCPT-0004",
          "REQ-RCPT-0005",
          "REQ-TRUST-0004",
          "REQ-TRUST-0006"
        ],
        "d2r": ["D2R-004A", "D2R-018"]
      }
    },
    {
      "logicalName": "SemanticCommitmentRef",